Id_Ciente;Nome;Conta N∫;DÌgito;AgÍncia; Saldo ; Limite ;Id do Cart„o;N˙mero do Cart„o; Limite do Cart„o ;News
96;Pep Teste;1000;3;1;R$ 0;R$ 500,00;88;**** **** **** 1236;R$ 1.000;[{'id': 219, 'icon': 'https://digitalinnovationone.github.io/santander-dev-week-2023-api/icons/credit.svg', 'description': 'Invista seu dinheiro e conquiste seus objetivos.'}, {'id': 220, 'icon': 'https://digitalinnovationone.github.io/santander-dev-week-2023-api/icons/credit.svg', 'description': 'Invista no seu futuro, Pep Teste. Fa√ßa seu dinheiro trabalhar por voc√™!'}, {'id': 398, 'icon': 'https://images.genius.com/31fac7e2bef0ff83f25dbd8077863794.1000x1000x1.jpg', 'description': 'Eduardo esteve aqui'}, {'id': 399, 'icon': 'https://images.genius.com/31fac7e2bef0ff83f25dbd8077863794.1000x1000x1.jpg', 'description': 'Eduardo esteve aqui'}, {'id': 1045, 'icon': 'https://digitalinnovationone.github.io/santander-dev-week-2023-api/icons/credit.svg', 'description': 'Pep Teste, no entanto, n√£o podemos esquecer que a consulta aos diversos militantes prepara-nos para enfrentar situa√ß√µes at√≠picas decorrentes das posturas dos √≥rg√£os dirigentes com rela√ß√£o √†s suas atribui√ß√µes. '}]
97;Wilker;0;1;1;R$ 0;R$ 5.000.000,00;89;**** **** **** 2101;R$ 0;[{'id': 84, 'icon': 'string', 'description': 'string'}, {'id': 400, 'icon': 'https://images.genius.com/31fac7e2bef0ff83f25dbd8077863794.1000x1000x1.jpg', 'description': 'Eduardo esteve aqui'}, {'id': 401, 'icon': 'https://images.genius.com/31fac7e2bef0ff83f25dbd8077863794.1000x1000x1.jpg', 'description': 'Eduardo esteve aqui'}, {'id': 1046, 'icon': 'https://digitalinnovationone.github.io/santander-dev-week-2023-api/icons/credit.svg', 'description': 'Wilker, nunca √© demais lembrar o peso e o significado destes problemas, uma vez que a ado√ß√£o de pol√≠ticas descentralizadoras assume importantes posi√ß√µes no estabelecimento dos m√©todos utilizados na avalia√ß√£o de resultados. '}]
98;Danillo;1;10;9999;R$ 0;R$ 25,00;90;**** **** **** 0101;R$ 10;[{'id': 402, 'icon': 'https://images.genius.com/31fac7e2bef0ff83f25dbd8077863794.1000x1000x1.jpg', 'description': 'Eduardo esteve aqui'}, {'id': 403, 'icon': 'https://images.genius.com/31fac7e2bef0ff83f25dbd8077863794.1000x1000x1.jpg', 'description': 'Eduardo esteve aqui'}, {'id': 1047, 'icon': 'https://digitalinnovationone.github.io/santander-dev-week-2023-api/icons/credit.svg', 'description': 'Danillo, do mesmo modo, a crescente influ√™ncia da m√≠dia garante a contribui√ß√£o de um grupo importante na determina√ß√£o dos paradigmas corporativos. '}]
99;Mark;1;11;9999;R$ 0;R$ 250,00;91;**** **** **** 1121;R$ 100;[{'id': 404, 'icon': 'https://images.genius.com/31fac7e2bef0ff83f25dbd8077863794.1000x1000x1.jpg', 'description': 'Eduardo esteve aqui'}, {'id': 405, 'icon': 'https://images.genius.com/31fac7e2bef0ff83f25dbd8077863794.1000x1000x1.jpg', 'description': 'Eduardo esteve aqui'}, {'id': 1048, 'icon': 'https://digitalinnovationone.github.io/santander-dev-week-2023-api/icons/credit.svg', 'description': 'Mark, √© claro que a consulta aos diversos militantes cumpre um papel essencial na formula√ß√£o da gest√£o inovadora da qual fazemos parte. '}]
100;Tony;1;12;9999;R$ 0;R$ 255,00;92;**** **** **** 1122;R$ 950;[{'id': 406, 'icon': 'https://images.genius.com/31fac7e2bef0ff83f25dbd8077863794.1000x1000x1.jpg', 'description': 'Eduardo esteve aqui'}, {'id': 407, 'icon': 'https://images.genius.com/31fac7e2bef0ff83f25dbd8077863794.1000x1000x1.jpg', 'description': 'Eduardo esteve aqui'}, {'id': 1049, 'icon': 'https://digitalinnovationone.github.io/santander-dev-week-2023-api/icons/credit.svg', 'description': 'Tony, evidentemente, a estrutura atual da organiza√ß√£o faz parte de um processo de gerenciamento do retorno esperado a longo prazo. '}]
101;M√°rcia;1;13;9999;R$ 0;R$ 55,00;93;**** **** **** 1123;R$ 50;[{'id': 408, 'icon': 'https://images.genius.com/31fac7e2bef0ff83f25dbd8077863794.1000x1000x1.jpg', 'description': 'Eduardo esteve aqui'}, {'id': 409, 'icon': 'https://images.genius.com/31fac7e2bef0ff83f25dbd8077863794.1000x1000x1.jpg', 'description': 'Eduardo esteve aqui'}, {'id': 1050, 'icon': 'https://digitalinnovationone.github.io/santander-dev-week-2023-api/icons/credit.svg', 'description': 'M√°rcia, todavia, a estrutura atual da organiza√ß√£o ainda n√£o demonstrou convincentemente que vai participar na mudan√ßa dos n√≠veis de motiva√ß√£o departamental. '}]
102;Donizeti;1;14;9999;R$ 0;R$ 555,00;94;**** **** **** 1124;R$ 505;[{'id': 410, 'icon': 'https://images.genius.com/31fac7e2bef0ff83f25dbd8077863794.1000x1000x1.jpg', 'description': 'Eduardo esteve aqui'}, {'id': 411, 'icon': 'https://images.genius.com/31fac7e2bef0ff83f25dbd8077863794.1000x1000x1.jpg', 'description': 'Eduardo esteve aqui'}, {'id': 1051, 'icon': 'https://digitalinnovationone.github.io/santander-dev-week-2023-api/icons/credit.svg', 'description': 'Donizeti, no mundo atual, o entendimento das metas propostas desafia a capacidade de equaliza√ß√£o de todos os recursos funcionais envolvidos. '}]
103;Gabriella;1;15;9999;R$ 0;R$ 600,00;95;**** **** **** 1125;R$ 400;[{'id': 412, 'icon': 'https://images.genius.com/31fac7e2bef0ff83f25dbd8077863794.1000x1000x1.jpg', 'description': 'Eduardo esteve aqui'}, {'id': 413, 'icon': 'https://images.genius.com/31fac7e2bef0ff83f25dbd8077863794.1000x1000x1.jpg', 'description': 'Eduardo esteve aqui'}, {'id': 1052, 'icon': 'https://digitalinnovationone.github.io/santander-dev-week-2023-api/icons/credit.svg', 'description': 'Gabriella, todas estas quest√µes, devidamente ponderadas, levantam d√∫vidas sobre se o entendimento das metas propostas faz parte de um processo de gerenciamento dos m√©todos utilizados na avalia√ß√£o de resultados. '}]
104;Tha√≠s;1;16;9999;R$ 0;R$ 700,00;96;**** **** **** 1126;R$ 200;[{'id': 414, 'icon': 'https://images.genius.com/31fac7e2bef0ff83f25dbd8077863794.1000x1000x1.jpg', 'description': 'Eduardo esteve aqui'}, {'id': 415, 'icon': 'https://images.genius.com/31fac7e2bef0ff83f25dbd8077863794.1000x1000x1.jpg', 'description': 'Eduardo esteve aqui'}, {'id': 1053, 'icon': 'https://digitalinnovationone.github.io/santander-dev-week-2023-api/icons/credit.svg', 'description': 'Tha√≠s, desta maneira, o comprometimento entre as equipes pode nos levar a considerar a reestrutura√ß√£o das condi√ß√µes financeiras e administrativas exigidas. '}]
105;Camylle;1;17;9999;R$ 0;R$ 420,00;97;**** **** **** 1127;R$ 270;[{'id': 416, 'icon': 'https://images.genius.com/31fac7e2bef0ff83f25dbd8077863794.1000x1000x1.jpg', 'description': 'Eduardo esteve aqui'}, {'id': 417, 'icon': 'https://images.genius.com/31fac7e2bef0ff83f25dbd8077863794.1000x1000x1.jpg', 'description': 'Eduardo esteve aqui'}, {'id': 1054, 'icon': 'https://digitalinnovationone.github.io/santander-dev-week-2023-api/icons/credit.svg', 'description': 'Camylle, todas estas quest√µes, devidamente ponderadas, levantam d√∫vidas sobre se a hegemonia do ambiente pol√≠tico possibilita uma melhor vis√£o global das posturas dos √≥rg√£os dirigentes com rela√ß√£o √†s suas atribui√ß√µes. '}]
106;Marcella;1;18;9999;R$ 0;R$ 4.200,00;98;**** **** **** 1128;R$ 2.700;[{'id': 418, 'icon': 'https://images.genius.com/31fac7e2bef0ff83f25dbd8077863794.1000x1000x1.jpg', 'description': 'Eduardo esteve aqui'}, {'id': 419, 'icon': 'https://images.genius.com/31fac7e2bef0ff83f25dbd8077863794.1000x1000x1.jpg', 'description': 'Eduardo esteve aqui'}, {'id': 1055, 'icon': 'https://digitalinnovationone.github.io/santander-dev-week-2023-api/icons/credit.svg', 'description': 'Marcella, ainda assim, existem d√∫vidas a respeito de como a valoriza√ß√£o de fatores subjetivos possibilita uma melhor vis√£o global da gest√£o inovadora da qual fazemos parte. '}]
107;√çtalo;1;19;9999;R$ 0;R$ 200,00;99;**** **** **** 1129;R$ 700;[{'id': 420, 'icon': 'https://images.genius.com/31fac7e2bef0ff83f25dbd8077863794.1000x1000x1.jpg', 'description': 'Eduardo esteve aqui'}, {'id': 421, 'icon': 'https://images.genius.com/31fac7e2bef0ff83f25dbd8077863794.1000x1000x1.jpg', 'description': 'Eduardo esteve aqui'}, {'id': 1056, 'icon': 'https://digitalinnovationone.github.io/santander-dev-week-2023-api/icons/credit.svg', 'description': '√çtalo, √© claro que o surgimento do com√©rcio virtual afeta positivamente a correta previs√£o das formas de a√ß√£o. '}, {'id': 1477, 'icon': 'https://digitalinnovationone.github.io/santander-dev-week-2023-api/icons/credit.svg', 'description': 'Invista agora e garanta seu futuro financeiro!'}]
108;Douglas;1;20;9999;R$ 0;R$ 100,00;100;**** **** **** 1130;R$ 600;[{'id': 422, 'icon': 'https://images.genius.com/31fac7e2bef0ff83f25dbd8077863794.1000x1000x1.jpg', 'description': 'Eduardo esteve aqui'}, {'id': 423, 'icon': 'https://images.genius.com/31fac7e2bef0ff83f25dbd8077863794.1000x1000x1.jpg', 'description': 'Eduardo esteve aqui'}, {'id': 1057, 'icon': 'https://digitalinnovationone.github.io/santander-dev-week-2023-api/icons/credit.svg', 'description': 'Douglas, o incentivo ao avan√ßo tecnol√≥gico, assim como o desafiador cen√°rio globalizado oferece uma interessante oportunidade para verifica√ß√£o dos √≠ndices pretendidos. '}]
109;Kau√£;1;21;9999;R$ 0;R$ 210,00;101;**** **** **** 1131;R$ 650;[{'id': 424, 'icon': 'https://images.genius.com/31fac7e2bef0ff83f25dbd8077863794.1000x1000x1.jpg', 'description': 'Eduardo esteve aqui'}, {'id': 425, 'icon': 'https://images.genius.com/31fac7e2bef0ff83f25dbd8077863794.1000x1000x1.jpg', 'description': 'Eduardo esteve aqui'}, {'id': 1058, 'icon': 'https://digitalinnovationone.github.io/santander-dev-week-2023-api/icons/credit.svg', 'description': 'Kau√£, n√£o obstante, o comprometimento entre as equipes exige a precis√£o e a defini√ß√£o dos √≠ndices pretendidos. '}]
110;Neymar JR;1;22;9999;R$ 0;R$ 2.200,00;102;**** **** **** 1132;R$ 9.900;[{'id': 426, 'icon': 'https://images.genius.com/31fac7e2bef0ff83f25dbd8077863794.1000x1000x1.jpg', 'description': 'Eduardo esteve aqui'}, {'id': 427, 'icon': 'https://images.genius.com/31fac7e2bef0ff83f25dbd8077863794.1000x1000x1.jpg', 'description': 'Eduardo esteve aqui'}, {'id': 1059, 'icon': 'https://digitalinnovationone.github.io/santander-dev-week-2023-api/icons/credit.svg', 'description': 'Neymar JR, pensando mais a longo prazo, a percep√ß√£o das dificuldades nos obriga √† an√°lise das condi√ß√µes financeiras e administrativas exigidas. '}]
111;L.Messi;1;23;9999;R$ 0;R$ 3.300,00;103;**** **** **** 1133;R$ 1.000;[{'id': 428, 'icon': 'https://images.genius.com/31fac7e2bef0ff83f25dbd8077863794.1000x1000x1.jpg', 'description': 'Eduardo esteve aqui'}, {'id': 429, 'icon': 'https://images.genius.com/31fac7e2bef0ff83f25dbd8077863794.1000x1000x1.jpg', 'description': 'Eduardo esteve aqui'}, {'id': 1060, 'icon': 'https://digitalinnovationone.github.io/santander-dev-week-2023-api/icons/credit.svg', 'description': 'L.Messi, pensando mais a longo prazo, o desafiador cen√°rio globalizado aponta para a melhoria de todos os recursos funcionais envolvidos. '}]
112;C.Ronaldo;1;24;9999;R$ 0;R$ 5.500,00;104;**** **** **** 1134;R$ 1.500;[{'id': 430, 'icon': 'https://images.genius.com/31fac7e2bef0ff83f25dbd8077863794.1000x1000x1.jpg', 'description': 'Eduardo esteve aqui'}, {'id': 431, 'icon': 'https://images.genius.com/31fac7e2bef0ff83f25dbd8077863794.1000x1000x1.jpg', 'description': 'Eduardo esteve aqui'}, {'id': 1061, 'icon': 'https://digitalinnovationone.github.io/santander-dev-week-2023-api/icons/credit.svg', 'description': 'C.Ronaldo, percebemos, cada vez mais, que a percep√ß√£o das dificuldades exige a precis√£o e a defini√ß√£o das regras de conduta normativas. '}]
113;Ronaldinho;1;25;9999;R$ 0;R$ 950,00;105;**** **** **** 1135;R$ 580;[{'id': 432, 'icon': 'https://images.genius.com/31fac7e2bef0ff83f25dbd8077863794.1000x1000x1.jpg', 'description': 'Eduardo esteve aqui'}, {'id': 433, 'icon': 'https://images.genius.com/31fac7e2bef0ff83f25dbd8077863794.1000x1000x1.jpg', 'description': 'Eduardo esteve aqui'}, {'id': 1062, 'icon': 'https://digitalinnovationone.github.io/santander-dev-week-2023-api/icons/credit.svg', 'description': 'Ronaldinho, por conseguinte, o surgimento do com√©rcio virtual apresenta tend√™ncias no sentido de aprovar a manuten√ß√£o das formas de a√ß√£o. '}]
114;Linus;1;26;9999;R$ 0;R$ 1.000,00;106;**** **** **** 1136;R$ 980;[{'id': 434, 'icon': 'https://images.genius.com/31fac7e2bef0ff83f25dbd8077863794.1000x1000x1.jpg', 'description': 'Eduardo esteve aqui'}, {'id': 435, 'icon': 'https://images.genius.com/31fac7e2bef0ff83f25dbd8077863794.1000x1000x1.jpg', 'description': 'Eduardo esteve aqui'}, {'id': 1063, 'icon': 'https://digitalinnovationone.github.io/santander-dev-week-2023-api/icons/credit.svg', 'description': 'Linus, o incentivo ao avan√ßo tecnol√≥gico, assim como a percep√ß√£o das dificuldades garante a contribui√ß√£o de um grupo importante na determina√ß√£o do retorno esperado a longo prazo. '}]
115;Bruna Marquezine;1;27;9999;R$ 0;R$ 760,00;107;**** **** **** 1137;R$ 930;[{'id': 436, 'icon': 'https://images.genius.com/31fac7e2bef0ff83f25dbd8077863794.1000x1000x1.jpg', 'description': 'Eduardo esteve aqui'}, {'id': 437, 'icon': 'https://images.genius.com/31fac7e2bef0ff83f25dbd8077863794.1000x1000x1.jpg', 'description': 'Eduardo esteve aqui'}, {'id': 1064, 'icon': 'https://digitalinnovationone.github.io/santander-dev-week-2023-api/icons/credit.svg', 'description': 'Bruna Marquezine, todavia, a consolida√ß√£o das estruturas exige a precis√£o e a defini√ß√£o do sistema de forma√ß√£o de quadros que corresponde √†s necessidades. '}]
116;Sueli;1;28;9999;R$ 0;R$ 410,00;108;**** **** **** 1138;R$ 340;[{'id': 438, 'icon': 'https://images.genius.com/31fac7e2bef0ff83f25dbd8077863794.1000x1000x1.jpg', 'description': 'Eduardo esteve aqui'}, {'id': 439, 'icon': 'https://images.genius.com/31fac7e2bef0ff83f25dbd8077863794.1000x1000x1.jpg', 'description': 'Eduardo esteve aqui'}, {'id': 1065, 'icon': 'https://digitalinnovationone.github.io/santander-dev-week-2023-api/icons/credit.svg', 'description': 'Sueli, assim mesmo, o julgamento imparcial das eventualidades ainda n√£o demonstrou convincentemente que vai participar na mudan√ßa de todos os recursos funcionais envolvidos. '}]
117;Falvo;1;29;9999;R$ 0;R$ 4.110,00;109;**** **** **** 1139;R$ 3.420;[{'id': 440, 'icon': 'https://images.genius.com/31fac7e2bef0ff83f25dbd8077863794.1000x1000x1.jpg', 'description': 'Eduardo esteve aqui'}, {'id': 441, 'icon': 'https://images.genius.com/31fac7e2bef0ff83f25dbd8077863794.1000x1000x1.jpg', 'description': 'Eduardo esteve aqui'}, {'id': 1066, 'icon': 'https://digitalinnovationone.github.io/santander-dev-week-2023-api/icons/credit.svg', 'description': 'Falvo, pensando mais a longo prazo, a valoriza√ß√£o de fatores subjetivos promove a alavancagem das dire√ß√µes preferenciais no sentido do progresso. '}]
118;Gustavo Guanabara;1;30;9999;R$ 0;R$ 3.110,00;110;**** **** **** 1140;R$ 2.420;[{'id': 442, 'icon': 'https://images.genius.com/31fac7e2bef0ff83f25dbd8077863794.1000x1000x1.jpg', 'description': 'Eduardo esteve aqui'}, {'id': 443, 'icon': 'https://images.genius.com/31fac7e2bef0ff83f25dbd8077863794.1000x1000x1.jpg', 'description': 'Eduardo esteve aqui'}, {'id': 1067, 'icon': 'https://digitalinnovationone.github.io/santander-dev-week-2023-api/icons/credit.svg', 'description': 'Gustavo Guanabara, desta maneira, a consulta aos diversos militantes desafia a capacidade de equaliza√ß√£o dos conhecimentos estrat√©gicos para atingir a excel√™ncia. '}]
121;Marcos;111;1;1;R$ 0;R$ 500,00;112;**** **** **** 9861;R$ 1.000;[{'id': 446, 'icon': 'https://images.genius.com/31fac7e2bef0ff83f25dbd8077863794.1000x1000x1.jpg', 'description': 'Eduardo esteve aqui'}, {'id': 447, 'icon': 'https://images.genius.com/31fac7e2bef0ff83f25dbd8077863794.1000x1000x1.jpg', 'description': 'Eduardo esteve aqui'}, {'id': 1069, 'icon': 'https://digitalinnovationone.github.io/santander-dev-week-2023-api/icons/credit.svg', 'description': 'Marcos, podemos j√° vislumbrar o modo pelo qual a mobilidade dos capitais internacionais √© uma das consequ√™ncias da gest√£o inovadora da qual fazemos parte. '}, {'id': 1299, 'icon': 'https://digitalinnovationone.github.io/santander-dev-week-2023-api/icons/credit.svg', 'description': 'Invista hoje. Colha amanh√£.'}]
122;Jorge;323;3;2;R$ 0;R$ 500,00;113;**** **** **** 1232;R$ 1.000;[{'id': 448, 'icon': 'https://images.genius.com/31fac7e2bef0ff83f25dbd8077863794.1000x1000x1.jpg', 'description': 'Eduardo esteve aqui'}, {'id': 449, 'icon': 'https://images.genius.com/31fac7e2bef0ff83f25dbd8077863794.1000x1000x1.jpg', 'description': 'Eduardo esteve aqui'}, {'id': 1070, 'icon': 'https://digitalinnovationone.github.io/santander-dev-week-2023-api/icons/credit.svg', 'description': 'Jorge, a n√≠vel organizacional, a estrutura atual da organiza√ß√£o desafia a capacidade de equaliza√ß√£o do investimento em reciclagem t√©cnica. '}, {'id': 1300, 'icon': 'https://digitalinnovationone.github.io/santander-dev-week-2023-api/icons/credit.svg', 'description': 'Invista no seu futuro financeiro!'}]
124;Marcio;1;1;1;R$ 0;R$ 500,00;115;N„o Possui Cart„o;R$ 0;[{'id': 450, 'icon': 'https://images.genius.com/31fac7e2bef0ff83f25dbd8077863794.1000x1000x1.jpg', 'description': 'Eduardo esteve aqui'}, {'id': 451, 'icon': 'https://images.genius.com/31fac7e2bef0ff83f25dbd8077863794.1000x1000x1.jpg', 'description': 'Eduardo esteve aqui'}, {'id': 1071, 'icon': 'https://digitalinnovationone.github.io/santander-dev-week-2023-api/icons/credit.svg', 'description': 'Marcio, o que temos que ter sempre em mente √© que o surgimento do com√©rcio virtual nos obriga √† an√°lise dos procedimentos normalmente adotados. '}]
125;Pablo;22;1;1;R$ 0;R$ 500,00;116;N„o Possui Cart„o;R$ 0;[{'id': 452, 'icon': 'https://images.genius.com/31fac7e2bef0ff83f25dbd8077863794.1000x1000x1.jpg', 'description': 'Eduardo esteve aqui'}, {'id': 453, 'icon': 'https://images.genius.com/31fac7e2bef0ff83f25dbd8077863794.1000x1000x1.jpg', 'description': 'Eduardo esteve aqui'}, {'id': 1072, 'icon': 'https://digitalinnovationone.github.io/santander-dev-week-2023-api/icons/credit.svg', 'description': 'Pablo, assim mesmo, o surgimento do com√©rcio virtual afeta positivamente a correta previs√£o dos relacionamentos verticais entre as hierarquias. '}]
126;Joao;1;0;11;R$ 0;R$ 1.000,00;117;**** **** **** 1111;R$ 1.500;[{'id': 454, 'icon': 'https://images.genius.com/31fac7e2bef0ff83f25dbd8077863794.1000x1000x1.jpg', 'description': 'Eduardo esteve aqui'}, {'id': 455, 'icon': 'https://images.genius.com/31fac7e2bef0ff83f25dbd8077863794.1000x1000x1.jpg', 'description': 'Eduardo esteve aqui'}, {'id': 1073, 'icon': 'https://digitalinnovationone.github.io/santander-dev-week-2023-api/icons/credit.svg', 'description': 'Joao, podemos j√° vislumbrar o modo pelo qual a crescente influ√™ncia da m√≠dia agrega valor ao estabelecimento de alternativas √†s solu√ß√µes ortodoxas. '}]
127;Carlos;11;2;11;R$ 0;R$ 1.000,00;118;**** **** **** 2121;R$ 1.500;[{'id': 456, 'icon': 'https://images.genius.com/31fac7e2bef0ff83f25dbd8077863794.1000x1000x1.jpg', 'description': 'Eduardo esteve aqui'}, {'id': 457, 'icon': 'https://images.genius.com/31fac7e2bef0ff83f25dbd8077863794.1000x1000x1.jpg', 'description': 'Eduardo esteve aqui'}, {'id': 1074, 'icon': 'https://digitalinnovationone.github.io/santander-dev-week-2023-api/icons/credit.svg', 'description': 'Carlos, neste sentido, a determina√ß√£o clara de objetivos facilita a cria√ß√£o das dire√ß√µes preferenciais no sentido do progresso. '}]
128;Claudia;12;2;11;R$ 0;R$ 1.000,00;119;**** **** **** 2222;R$ 1.500;[{'id': 458, 'icon': 'https://images.genius.com/31fac7e2bef0ff83f25dbd8077863794.1000x1000x1.jpg', 'description': 'Eduardo esteve aqui'}, {'id': 459, 'icon': 'https://images.genius.com/31fac7e2bef0ff83f25dbd8077863794.1000x1000x1.jpg', 'description': 'Eduardo esteve aqui'}, {'id': 1075, 'icon': 'https://digitalinnovationone.github.io/santander-dev-week-2023-api/icons/credit.svg', 'description': 'Claudia, nunca √© demais lembrar o peso e o significado destes problemas, uma vez que a estrutura atual da organiza√ß√£o deve passar por modifica√ß√µes independentemente das condi√ß√µes financeiras e administrativas exigidas. '}]
129;Fernando;22;2;11;R$ 0;R$ 1.000,00;120;**** **** **** 2222;R$ 1.500;[{'id': 460, 'icon': 'https://images.genius.com/31fac7e2bef0ff83f25dbd8077863794.1000x1000x1.jpg', 'description': 'Eduardo esteve aqui'}, {'id': 461, 'icon': 'https://images.genius.com/31fac7e2bef0ff83f25dbd8077863794.1000x1000x1.jpg', 'description': 'Eduardo esteve aqui'}, {'id': 1076, 'icon': 'https://digitalinnovationone.github.io/santander-dev-week-2023-api/icons/credit.svg', 'description': 'Fernando, √© claro que a necessidade de renova√ß√£o processual prepara-nos para enfrentar situa√ß√µes at√≠picas decorrentes de alternativas √†s solu√ß√µes ortodoxas. '}]
130;Jose;22;3;11;R$ 0;R$ 1.000,00;121;**** **** **** 2222;R$ 1.500;[{'id': 462, 'icon': 'https://images.genius.com/31fac7e2bef0ff83f25dbd8077863794.1000x1000x1.jpg', 'description': 'Eduardo esteve aqui'}, {'id': 463, 'icon': 'https://images.genius.com/31fac7e2bef0ff83f25dbd8077863794.1000x1000x1.jpg', 'description': 'Eduardo esteve aqui'}, {'id': 1077, 'icon': 'https://digitalinnovationone.github.io/santander-dev-week-2023-api/icons/credit.svg', 'description': 'Jose, caros amigos, a crescente influ√™ncia da m√≠dia talvez venha a ressaltar a relatividade do impacto na agilidade decis√≥ria. '}]
131;Diego;100001;1;1001;R$ 0;R$ 1.000,00;122;**** **** **** 7821;R$ 1.000;[{'id': 93, 'icon': 'string', 'description': 'string'}, {'id': 464, 'icon': 'https://images.genius.com/31fac7e2bef0ff83f25dbd8077863794.1000x1000x1.jpg', 'description': 'Eduardo esteve aqui'}, {'id': 465, 'icon': 'https://images.genius.com/31fac7e2bef0ff83f25dbd8077863794.1000x1000x1.jpg', 'description': 'Eduardo esteve aqui'}, {'id': 1078, 'icon': 'https://digitalinnovationone.github.io/santander-dev-week-2023-api/icons/credit.svg', 'description': 'Diego, por conseguinte, o consenso sobre a necessidade de qualifica√ß√£o faz parte de um processo de gerenciamento de alternativas √†s solu√ß√µes ortodoxas. '}, {'id': 1450, 'icon': 'https://digitalinnovationone.github.io/santander-dev-week-2023-api/icons/credit.svg', 'description': 'Diego, n√£o deixe o seu dinheiro parado! Invista e fa√ßa ele trabalhar por voc√™.'}]
133;Ingrid;10022;1;1001;R$ 0;R$ 1.000,00;124;**** **** **** 7891;R$ 1.000;[{'id': 95, 'icon': 'string', 'description': 'string'}, {'id': 466, 'icon': 'https://images.genius.com/31fac7e2bef0ff83f25dbd8077863794.1000x1000x1.jpg', 'description': 'Eduardo esteve aqui'}, {'id': 467, 'icon': 'https://images.genius.com/31fac7e2bef0ff83f25dbd8077863794.1000x1000x1.jpg', 'description': 'Eduardo esteve aqui'}, {'id': 1079, 'icon': 'https://digitalinnovationone.github.io/santander-dev-week-2023-api/icons/credit.svg', 'description': 'Ingrid, assim mesmo, a complexidade dos estudos efetuados talvez venha a ressaltar a relatividade das diversas correntes de pensamento. '}, {'id': 1451, 'icon': 'https://digitalinnovationone.github.io/santander-dev-week-2023-api/icons/credit.svg', 'description': 'Ingrid, invista no seu futuro! üåü'}]
134;Olga;10025;1;1001;R$ 0;R$ 1.000,00;125;**** **** **** 7889;R$ 1.000;[{'id': 96, 'icon': 'string', 'description': 'string'}, {'id': 468, 'icon': 'https://images.genius.com/31fac7e2bef0ff83f25dbd8077863794.1000x1000x1.jpg', 'description': 'Eduardo esteve aqui'}, {'id': 469, 'icon': 'https://images.genius.com/31fac7e2bef0ff83f25dbd8077863794.1000x1000x1.jpg', 'description': 'Eduardo esteve aqui'}, {'id': 1080, 'icon': 'https://digitalinnovationone.github.io/santander-dev-week-2023-api/icons/credit.svg', 'description': 'Olga, no mundo atual, a mobilidade dos capitais internacionais faz parte de um processo de gerenciamento do processo de comunica√ß√£o como um todo. '}, {'id': 1452, 'icon': 'https://digitalinnovationone.github.io/santander-dev-week-2023-api/icons/credit.svg', 'description': 'Olga, invista para o seu futuro! N√£o deixe o tempo passar sem aproveitar as oportunidades. #InvestirParaCrescer (99 caracteres)'}]
135;Pablo;1;5;1;R$ 0;R$ 200,00;126;**** **** **** 1995;R$ 100;[{'id': 97, 'icon': 'string', 'description': 'string'}, {'id': 470, 'icon': 'https://images.genius.com/31fac7e2bef0ff83f25dbd8077863794.1000x1000x1.jpg', 'description': 'Eduardo esteve aqui'}, {'id': 471, 'icon': 'https://images.genius.com/31fac7e2bef0ff83f25dbd8077863794.1000x1000x1.jpg', 'description': 'Eduardo esteve aqui'}, {'id': 1081, 'icon': 'https://digitalinnovationone.github.io/santander-dev-week-2023-api/icons/credit.svg', 'description': 'Pablo, desta maneira, a constante divulga√ß√£o das informa√ß√µes exige a precis√£o e a defini√ß√£o dos paradigmas corporativos. '}]
136;Marcio J;25;5;1;R$ 0;R$ 20,00;127;**** **** **** 2000;R$ 10.000;[{'id': 98, 'icon': 'string', 'description': 'string'}, {'id': 472, 'icon': 'https://images.genius.com/31fac7e2bef0ff83f25dbd8077863794.1000x1000x1.jpg', 'description': 'Eduardo esteve aqui'}, {'id': 473, 'icon': 'https://images.genius.com/31fac7e2bef0ff83f25dbd8077863794.1000x1000x1.jpg', 'description': 'Eduardo esteve aqui'}, {'id': 1082, 'icon': 'https://digitalinnovationone.github.io/santander-dev-week-2023-api/icons/credit.svg', 'description': 'Marcio J, no mundo atual, o julgamento imparcial das eventualidades causa impacto indireto na reavalia√ß√£o do impacto na agilidade decis√≥ria. '}]
